{
  "schema": "lightning.accept.expect/1",
  "scene": "tesr-pipes",
  "compare": {
    "pairs": "all-cameras",
    "normalize": "per-face-luminance",
    "exclude": [
      "sky"
    ],
    "thresholds": {
      "silhouetteIoU": 0.98,
      "faceColorDelta": 0.06,
      "seamEdgeMax": 0.05
    }
  },
  "checks": [
    {
      "kind": "opaque",
      "id": "pipe-0",
      "at": [
        0,
        0,
        0
      ],
      "min_coverage": 0.05,
      "coverage_tolerance": 0.25
    },
    {
      "kind": "opaque",
      "id": "pipe-1",
      "at": [
        1,
        0,
        0
      ],
      "min_coverage": 0.05,
      "coverage_tolerance": 0.25
    },
    {
      "kind": "opaque",
      "id": "pipe-2",
      "at": [
        2,
        0,
        0
      ],
      "min_coverage": 0.05,
      "coverage_tolerance": 0.25
    },
    {
      "kind": "opaque",
      "id": "pipe-3",
      "at": [
        3,
        0,
        0
      ],
      "min_coverage": 0.05,
      "coverage_tolerance": 0.25
    },
    {
      "kind": "opaque",
      "id": "chest",
      "at": [
        4,
        0,
        0
      ],
      "min_coverage": 0.2,
      "coverage_tolerance": 0.25
    }
  ]
}
