{
  "schema": "lightning.accept.expect/1",
  "scene": "ctm-glass",
  "compare": {
    "pairs": "all-cameras",
    "normalize": "per-face-luminance",
    "exclude": [
      "sky"
    ],
    "thresholds": {
      "silhouetteIoU": 0.98,
      "faceColorDelta": 0.06,
      "seamEdgeMax": 0.05
    }
  },
  "checks": [
    {
      "kind": "opaque",
      "id": "stone",
      "at": [
        0,
        0,
        0
      ]
    },
    {
      "kind": "opaque",
      "id": "magnetic",
      "at": [
        3,
        0,
        0
      ]
    },
    {
      "kind": "opaque",
      "id": "gravity",
      "at": [
        4,
        0,
        0
      ]
    },
    {
      "kind": "region",
      "id": "acc-transparent-1",
      "at": [
        1,
        0,
        0
      ],
      "expect": "background",
      "cameras": [
        "front",
        "back"
      ]
    },
    {
      "kind": "region",
      "id": "acc-transparent-2",
      "at": [
        2,
        0,
        0
      ],
      "expect": "background",
      "cameras": [
        "front",
        "back"
      ]
    },
    {
      "kind": "seam",
      "id": "seam-glass-pair",
      "between": [
        [
          1,
          0,
          0
        ],
        [
          2,
          0,
          0
        ]
      ],
      "axis": "x",
      "cameras": [
        "front",
        "back"
      ]
    },
    {
      "kind": "seam",
      "id": "seam-stone-glass",
      "between": [
        [
          0,
          0,
          0
        ],
        [
          1,
          0,
          0
        ]
      ],
      "axis": "x",
      "cameras": [
        "front",
        "back"
      ]
    }
  ]
}
