{
  "schema": "lightning.accept.expect/1",
  "scene": "pr91-pipes-chest-legacy",
  "compare": {
    "pairs": "all-cameras",
    "normalize": "per-face-luminance",
    "exclude": [
      "sky"
    ],
    "thresholds": {
      "silhouetteIoU": 0.9,
      "faceColorDelta": 0.06,
      "seamEdgeMax": 0.05
    }
  },
  "checks": [
    {
      "kind": "opaque",
      "id": "pipe-1",
      "at": [
        1,
        0,
        1
      ],
      "min_coverage": 0.05
    },
    {
      "kind": "opaque",
      "id": "pipe-2",
      "at": [
        2,
        0,
        1
      ],
      "min_coverage": 0.05
    },
    {
      "kind": "opaque",
      "id": "pipe-3",
      "at": [
        3,
        0,
        1
      ],
      "min_coverage": 0.05
    },
    {
      "kind": "opaque",
      "id": "pipe-4",
      "at": [
        4,
        0,
        1
      ],
      "min_coverage": 0.05
    },
    {
      "kind": "opaque",
      "id": "chest",
      "at": [
        5,
        0,
        1
      ],
      "min_coverage": 0.3
    }
  ]
}
